{
  "schemaVersion": "1.0",
  "sequence": [
    { "id": "e1", "shape": "circle" },
    { "id": "e2", "shape": "square" },
    { "id": "e3", "shape": "circle" },
    { "id": "e4", "shape": "square" }
  ],
  "interaction": "complete-sequence",
  "candidates": [
    { "id": "c1", "shape": "circle" },
    { "id": "c2", "shape": "square" },
    { "id": "c3", "shape": "triangle" }
  ]
}